{
  "id": "saas-dcs-001",
  "metadata": {
    "database": "saas",
    "conversationType": "DCS",
    "expectedTurns": 14,
    "compressionBoundaryTurn": 5,
    "userPersona": "business",
    "tablesExplored": ["accounts", "subscriptions", "invoices", "plans"],
    "description": "Deep callback session with early baseline establishment and long-distance callbacks"
  },
  "turns": [
    {
      "turnNumber": 1,
      "role": "user",
      "content": "First, let me set a baseline — what was total MRR in January 2024? Note that number for me.",
      "annotations": {
        "type": "opening",
        "expectedBehavior": "Agent should calculate and note January 2024 MRR"
      }
    },
    {
      "turnNumber": 2,
      "role": "user",
      "content": "For this entire session, always exclude trial accounts from all analyses.",
      "annotations": {
        "type": "correction",
        "isCorrection": true,
        "establishesFilter": "Exclude trial accounts",
        "correctionType": "explicit",
        "expectedBehavior": "Agent should filter out trial tier"
      }
    },
    {
      "turnNumber": 3,
      "role": "user",
      "content": "For MRR calculations, use plan.monthly_price as the base.",
      "annotations": {
        "type": "correction",
        "isCorrection": true,
        "establishesFilter": "Use plan.monthly_price for MRR",
        "correctionType": "explicit",
        "expectedBehavior": "Agent should use monthly_price for MRR"
      }
    },
    {
      "turnNumber": 4,
      "role": "user",
      "content": "Now show me account growth by month throughout 2024.",
      "annotations": {
        "type": "hypothesis_exploration",
        "expectedBehavior": "Agent should show monthly account counts"
      }
    },
    {
      "turnNumber": 5,
      "role": "user",
      "content": "Show me revenue by plan tier.",
      "annotations": {
        "type": "hypothesis_exploration",
        "expectedBehavior": "Agent should show revenue breakdown by tier"
      }
    },
    {
      "turnNumber": 6,
      "role": "user",
      "content": "Which industries are our top revenue generators?",
      "annotations": {
        "type": "hypothesis_exploration",
        "expectedBehavior": "Agent should show revenue by industry"
      }
    },
    {
      "turnNumber": 7,
      "role": "user",
      "content": "What's the subscription renewal rate?",
      "annotations": {
        "type": "hypothesis_exploration",
        "expectedBehavior": "Agent should calculate renewal rate"
      }
    },
    {
      "turnNumber": 8,
      "role": "user",
      "content": "What was that January 2024 MRR number we established at the start? I need it as a baseline.",
      "annotations": {
        "type": "callback",
        "isCallback": true,
        "callbackTargetTurn": 1,
        "crossesCompressionBoundary": true,
        "expectedBehavior": "Agent should recall January 2024 MRR baseline"
      }
    },
    {
      "turnNumber": 9,
      "role": "user",
      "content": "If January was our baseline, what percentage of that did we achieve in each subsequent month?",
      "annotations": {
        "type": "aggregation",
        "expectedBehavior": "Agent should calculate monthly MRR as % of January"
      }
    },
    {
      "turnNumber": 10,
      "role": "user",
      "content": "Remember the trial exclusion we established? Apply that to show me account count trends.",
      "annotations": {
        "type": "anaphoric_reference",
        "isAnaphoricReference": true,
        "anaphoricTargetTurn": 2,
        "anaphoricPhrase": "the trial exclusion we established",
        "crossesCompressionBoundary": true,
        "expectedBehavior": "Agent should apply trial exclusion filter"
      }
    },
    {
      "turnNumber": 11,
      "role": "user",
      "content": "Earlier you showed me revenue by tier. Can you show that again with the baseline comparison?",
      "annotations": {
        "type": "callback",
        "isCallback": true,
        "callbackTargetTurn": 5,
        "crossesCompressionBoundary": true,
        "expectedBehavior": "Agent should recall tier revenue and add baseline context"
      }
    },
    {
      "turnNumber": 12,
      "role": "user",
      "content": "Create a chart showing MRR relative to January baseline.",
      "annotations": {
        "type": "chart_request",
        "chartRequested": true,
        "expectedBehavior": "Agent should create baseline comparison visualization"
      }
    },
    {
      "turnNumber": 13,
      "role": "user",
      "content": "What was the January MRR again?",
      "annotations": {
        "type": "callback",
        "isCallback": true,
        "callbackTargetTurn": 1,
        "crossesCompressionBoundary": true,
        "expectedBehavior": "Agent should recall January MRR"
      }
    },
    {
      "turnNumber": 14,
      "role": "user",
      "content": "Thank you. We've established that MRR grew 23% from the January baseline of $2.1M to $2.6M in December, driven primarily by Enterprise tier expansion.",
      "annotations": {
        "type": "final_query",
        "expectedBehavior": "Agent should acknowledge findings"
      }
    }
  ],
  "persistedCorrections": [
    {
      "turnEstablished": 2,
      "correctionText": "Exclude trial accounts from all analyses",
      "type": "exclusion",
      "description": "Filter out trial tier"
    },
    {
      "turnEstablished": 3,
      "correctionText": "Use plan.monthly_price for MRR calculations",
      "type": "aggregation_method",
      "description": "Use monthly_price for MRR base"
    }
  ],
  "anaphoricReferences": [
    {
      "sourceTurn": 10,
      "targetTurn": 2,
      "phrase": "the trial exclusion we established",
      "crossesCompressionBoundary": true,
      "expectedResolution": "Exclude trial accounts filter",
      "distance": 8
    }
  ],
  "callbacks": [
    {
      "sourceTurn": 8,
      "targetTurn": 1,
      "callbackType": "value_recall",
      "expectedEntity": "January 2024 MRR baseline",
      "crossesCompressionBoundary": true,
      "distance": 7
    },
    {
      "sourceTurn": 11,
      "targetTurn": 5,
      "callbackType": "result_recall",
      "expectedEntity": "Revenue by tier data",
      "crossesCompressionBoundary": true,
      "distance": 6
    },
    {
      "sourceTurn": 13,
      "targetTurn": 1,
      "callbackType": "value_recall",
      "expectedEntity": "January MRR baseline",
      "crossesCompressionBoundary": true,
      "distance": 12
    }
  ]
}
