{
  "id": "saas-sncj-001",
  "metadata": {
    "database": "saas",
    "conversationType": "SNCJ",
    "expectedTurns": 16,
    "compressionBoundaryTurn": 6,
    "userPersona": "technical",
    "tablesExplored": ["accounts", "users", "subscriptions"],
    "description": "Schema navigation and complex joins: Account-User-Subscription relationships"
  },
  "turns": [
    {
      "turnNumber": 1,
      "role": "user",
      "content": "Before we start, walk me through what tables are available in our SaaS database.",
      "annotations": {
        "type": "schema_probe",
        "expectedBehavior": "Agent should list all tables: accounts, users, subscriptions, plans, invoices, events, feature_usage"
      }
    },
    {
      "turnNumber": 2,
      "role": "user",
      "content": "What columns does the accounts table have?",
      "annotations": {
        "type": "schema_probe",
        "expectedBehavior": "Agent should show accounts table schema"
      }
    },
    {
      "turnNumber": 3,
      "role": "user",
      "content": "What about the users table?",
      "annotations": {
        "type": "schema_probe",
        "expectedBehavior": "Agent should show users table schema"
      }
    },
    {
      "turnNumber": 4,
      "role": "user",
      "content": "How do I join accounts to users? What's the key?",
      "annotations": {
        "type": "schema_probe",
        "expectedBehavior": "Agent should explain users.account_id foreign key"
      }
    },
    {
      "turnNumber": 5,
      "role": "user",
      "content": "What columns does the subscriptions table have?",
      "annotations": {
        "type": "schema_probe",
        "expectedBehavior": "Agent should show subscriptions table schema"
      }
    },
    {
      "turnNumber": 6,
      "role": "user",
      "content": "Give me a simple count of users per account.",
      "annotations": {
        "type": "hypothesis_exploration",
        "expectedBehavior": "Agent should join users to accounts and count"
      }
    },
    {
      "turnNumber": 7,
      "role": "user",
      "content": "For this session, always use users.account_id for joining users to accounts.",
      "annotations": {
        "type": "correction",
        "isCorrection": true,
        "establishesFilter": "Use users.account_id for user-account joins",
        "correctionType": "explicit",
        "expectedBehavior": "Agent should confirm and use account_id for joins"
      }
    },
    {
      "turnNumber": 8,
      "role": "user",
      "content": "Now add the subscription plan from the subscriptions table.",
      "annotations": {
        "type": "refinement",
        "expectedBehavior": "Agent should join subscriptions to show plan"
      }
    },
    {
      "turnNumber": 9,
      "role": "user",
      "content": "Exclude trial subscriptions from all our analyses.",
      "annotations": {
        "type": "correction",
        "isCorrection": true,
        "establishesFilter": "Exclude trial subscriptions",
        "correctionType": "explicit",
        "expectedBehavior": "Agent should filter out trial status"
      }
    },
    {
      "turnNumber": 10,
      "role": "user",
      "content": "Apply the same join key we established to show me accounts with multiple subscriptions.",
      "annotations": {
        "type": "anaphoric_reference",
        "isAnaphoricReference": true,
        "anaphoricTargetTurn": 7,
        "anaphoricPhrase": "the same join key we established",
        "crossesCompressionBoundary": true,
        "expectedBehavior": "Agent should use account_id for joins"
      }
    },
    {
      "turnNumber": 11,
      "role": "user",
      "content": "Earlier you mentioned the subscriptions table schema. What were the possible status values?",
      "annotations": {
        "type": "callback",
        "isCallback": true,
        "callbackTargetTurn": 5,
        "crossesCompressionBoundary": true,
        "expectedBehavior": "Agent should recall subscription status values"
      }
    },
    {
      "turnNumber": 12,
      "role": "user",
      "content": "Show me accounts with their user count and subscription details.",
      "annotations": {
        "type": "hypothesis_exploration",
        "expectedBehavior": "Agent should join accounts-users-subscriptions"
      }
    },
    {
      "turnNumber": 13,
      "role": "user",
      "content": "Apply all our filters to show me the top accounts by user count.",
      "annotations": {
        "type": "anaphoric_reference",
        "isAnaphoricReference": true,
        "anaphoricTargetTurn": 9,
        "anaphoricPhrase": "all our filters",
        "crossesCompressionBoundary": true,
        "expectedBehavior": "Agent should apply: account_id joins, exclude trial"
      }
    },
    {
      "turnNumber": 14,
      "role": "user",
      "content": "What join key did we establish for user-account joins?",
      "annotations": {
        "type": "callback",
        "isCallback": true,
        "callbackTargetTurn": 7,
        "crossesCompressionBoundary": true,
        "expectedBehavior": "Agent should recall account_id join key"
      }
    },
    {
      "turnNumber": 15,
      "role": "user",
      "content": "Show me a final summary of account-user-subscription relationships.",
      "annotations": {
        "type": "final_query",
        "expectedBehavior": "Agent should provide comprehensive join summary"
      }
    },
    {
      "turnNumber": 16,
      "role": "user",
      "content": "Thank you. We've mapped the account-user-subscription relationships, identifying that accounts with 10+ users have 85% active subscription rate, while single-user accounts have higher churn.",
      "annotations": {
        "type": "final_query",
        "expectedBehavior": "Agent should acknowledge findings"
      }
    }
  ],
  "persistedCorrections": [
    {
      "turnEstablished": 7,
      "correctionText": "Use users.account_id for joining users to accounts",
      "type": "join_key",
      "description": "Always use account_id for user-account joins"
    },
    {
      "turnEstablished": 9,
      "correctionText": "Exclude trial subscriptions from all analyses",
      "type": "exclusion",
      "description": "Filter out trial status"
    }
  ],
  "anaphoricReferences": [
    {
      "sourceTurn": 10,
      "targetTurn": 7,
      "phrase": "the same join key we established",
      "crossesCompressionBoundary": true,
      "expectedResolution": "users.account_id for joins",
      "distance": 3
    },
    {
      "sourceTurn": 13,
      "targetTurn": 9,
      "phrase": "all our filters",
      "crossesCompressionBoundary": true,
      "expectedResolution": "account_id joins, exclude trial",
      "distance": 4
    }
  ],
  "callbacks": [
    {
      "sourceTurn": 11,
      "targetTurn": 5,
      "callbackType": "schema_recall",
      "expectedEntity": "Subscription status values",
      "crossesCompressionBoundary": true,
      "distance": 6
    },
    {
      "sourceTurn": 14,
      "targetTurn": 7,
      "callbackType": "filter_recall",
      "expectedEntity": "account_id join key",
      "crossesCompressionBoundary": true,
      "distance": 7
    }
  ]
}
