{
  "id": "tpch-pta-001",
  "metadata": {
    "database": "tpch",
    "conversationType": "PTA",
    "expectedTurns": 15,
    "compressionBoundaryTurn": 6,
    "userPersona": "business",
    "tablesExplored": [
      "ORDERS",
      "LINEITEM",
      "SUPPLIER",
      "NATION",
      "REGION",
      "CUSTOMER",
      "PARTSUPP"
    ],
    "description": "Parallel analysis of orders volume trends vs supplier performance across regions"
  },
  "turns": [
    {
      "turnNumber": 1,
      "role": "user",
      "content": "I want to analyze two different aspects today. First, I want to look at orders volume trends by month. Second, I want to investigate supplier performance ratings. Let's start with the orders volume analysis.",
      "annotations": {
        "type": "opening",
        "threadContext": "A",
        "expectedBehavior": "Agent should begin Thread A: orders volume analysis"
      }
    },
    {
      "turnNumber": 2,
      "role": "user",
      "content": "From now on, for order analysis, always exclude orders with status 'F' — those are flagged as problematic.",
      "annotations": {
        "type": "correction",
        "threadContext": "A",
        "isCorrection": true,
        "establishesFilter": "O_ORDERSTATUS != 'F' for Thread A",
        "correctionType": "explicit",
        "expectedBehavior": "Agent should apply this filter only to Thread A queries"
      }
    },
    {
      "turnNumber": 3,
      "role": "user",
      "content": "Now let's switch to Thread B. I want to look at supplier performance. Show me the top 20 suppliers by total supply volume and their availability percentages.",
      "annotations": {
        "type": "hypothesis_exploration",
        "threadContext": "B",
        "expectedBehavior": "Agent should begin Thread B: supplier performance analysis"
      }
    },
    {
      "turnNumber": 4,
      "role": "user",
      "content": "For supplier analysis, always use the NATION table for supplier location, not the region directly.",
      "annotations": {
        "type": "correction",
        "threadContext": "B",
        "isCorrection": true,
        "establishesFilter": "Join SUPPLIER to NATION for location (Thread B only)",
        "correctionType": "explicit",
        "expectedBehavior": "Agent should use NATION table for supplier location in Thread B"
      }
    },
    {
      "turnNumber": 5,
      "role": "user",
      "content": "Back to Thread A. Which order priorities had the most significant month-over-month revenue changes?",
      "annotations": {
        "type": "hypothesis_exploration",
        "threadContext": "A",
        "expectedBehavior": "Agent should calculate month-over-month changes by priority"
      }
    },
    {
      "turnNumber": 6,
      "role": "user",
      "content": "Now cross-reference: Are the regions with high priority orders in March from Thread A using suppliers from Thread B's top efficient list?",
      "annotations": {
        "type": "aggregation",
        "threadContext": "cross_reference",
        "expectedBehavior": "Agent should check if high priority order regions use efficient suppliers"
      }
    },
    {
      "turnNumber": 7,
      "role": "user",
      "content": "Back to Thread A. Apply the same filters we established earlier — show me orders excluding status 'F'.",
      "annotations": {
        "type": "anaphoric_reference",
        "threadContext": "A",
        "isAnaphoricReference": true,
        "anaphoricTargetTurn": 2,
        "anaphoricPhrase": "the same filters we established earlier",
        "expectedBehavior": "Agent should apply O_ORDERSTATUS != 'F' filter"
      }
    },
    {
      "turnNumber": 8,
      "role": "user",
      "content": "Show me the same for the other thread.",
      "annotations": {
        "type": "anaphoric_reference",
        "threadContext": "A",
        "isAnaphoricReference": true,
        "anaphoricTargetTurn": 7,
        "anaphoricPhrase": "the same for the other thread",
        "crossesCompressionBoundary": true,
        "expectedBehavior": "Agent should show order fulfillment volume for Thread B (suppliers)"
      }
    },
    {
      "turnNumber": 9,
      "role": "user",
      "content": "That's not right — I meant show me the supplier efficiency breakdown for Thread B. The previous query was applying Thread A's order logic to Thread B.",
      "annotations": {
        "type": "correction",
        "threadContext": "B",
        "isCorrection": true,
        "correctionType": "explicit",
        "expectedBehavior": "Agent should correct and show Thread B specific analysis"
      }
    },
    {
      "turnNumber": 10,
      "role": "user",
      "content": "Thread B: Remember to use the NATION table for supplier location.",
      "annotations": {
        "type": "anaphoric_reference",
        "threadContext": "B",
        "isAnaphoricReference": true,
        "anaphoricTargetTurn": 4,
        "anaphoricPhrase": "remember, use the NATION table",
        "crossesCompressionBoundary": true,
        "expectedBehavior": "Agent should use NATION table as established in Thread B"
      }
    },
    {
      "turnNumber": 11,
      "role": "user",
      "content": "Thread A: Earlier you showed me revenue by priority — what was the high priority total again?",
      "annotations": {
        "type": "callback",
        "threadContext": "A",
        "isCallback": true,
        "callbackTargetTurn": 5,
        "crossesCompressionBoundary": true,
        "expectedBehavior": "Agent should recall high priority revenue from Thread A"
      }
    },
    {
      "turnNumber": 12,
      "role": "user",
      "content": "Thread A: Exclude orders from 'ASIA' region going forward — we're focusing on other markets.",
      "annotations": {
        "type": "correction",
        "threadContext": "A",
        "isCorrection": true,
        "establishesFilter": "Exclude ASIA region for Thread A",
        "correctionType": "explicit",
        "expectedBehavior": "Agent should apply ASIA exclusion only to Thread A"
      }
    },
    {
      "turnNumber": 13,
      "role": "user",
      "content": "Thread B: Are any efficient suppliers from ASIA? If so, mark them for review.",
      "annotations": {
        "type": "hypothesis_exploration",
        "threadContext": "B",
        "expectedBehavior": "Agent should identify ASIA efficient suppliers"
      }
    },
    {
      "turnNumber": 14,
      "role": "user",
      "content": "Final synthesis: Which customer nations from Thread A are served by which efficient supplier nations from Thread B?",
      "annotations": {
        "type": "final_query",
        "threadContext": "cross_reference",
        "expectedBehavior": "Agent should show customer-supplier nation alignment"
      }
    },
    {
      "turnNumber": 15,
      "role": "user",
      "content": "Thread A: Confirm what filters are currently active for this thread.",
      "annotations": {
        "type": "probe",
        "threadContext": "A",
        "expectedBehavior": "Agent should list Thread A filters: O_ORDERSTATUS != 'F', exclude ASIA"
      }
    }
  ],
  "persistedCorrections": [
    {
      "turnEstablished": 2,
      "correctionText": "Exclude orders with status 'F' for Thread A",
      "type": "filter_rule",
      "description": "O_ORDERSTATUS != 'F' only for Thread A"
    },
    {
      "turnEstablished": 4,
      "correctionText": "Use NATION table for supplier location in Thread B",
      "type": "table_alias",
      "description": "Join SUPPLIER to NATION for location (Thread B only)"
    },
    {
      "turnEstablished": 12,
      "correctionText": "Exclude ASIA region for Thread A",
      "type": "exclusion",
      "description": "Filter out ASIA region for Thread A orders only"
    }
  ],
  "anaphoricReferences": [
    {
      "sourceTurn": 7,
      "targetTurn": 2,
      "phrase": "the same filters we established earlier",
      "crossesCompressionBoundary": false,
      "expectedResolution": "O_ORDERSTATUS != 'F' filter for Thread A",
      "distance": 5
    },
    {
      "sourceTurn": 8,
      "targetTurn": 7,
      "phrase": "the same for the other thread",
      "crossesCompressionBoundary": true,
      "expectedResolution": "Order fulfillment volume for Thread B (suppliers)",
      "distance": 1
    },
    {
      "sourceTurn": 10,
      "targetTurn": 4,
      "phrase": "remember, use the NATION table",
      "crossesCompressionBoundary": true,
      "expectedResolution": "Use NATION table for supplier location in Thread B",
      "distance": 6
    }
  ],
  "callbacks": [
    {
      "sourceTurn": 11,
      "targetTurn": 5,
      "callbackType": "value_recall",
      "expectedEntity": "High priority revenue from Thread A",
      "crossesCompressionBoundary": true,
      "distance": 6
    }
  ]
}
