{
  "id": "saas-pta-003",
  "metadata": {
    "database": "saas",
    "conversationType": "PTA",
    "expectedTurns": 15,
    "compressionBoundaryTurn": 5,
    "userPersona": "mixed",
    "tablesExplored": ["invoices", "events", "accounts", "users"],
    "description": "Parallel threads: Invoice analysis (A) vs Event patterns (B)"
  },
  "turns": [
    {
      "turnNumber": 1,
      "role": "user",
      "content": "I want to explore two areas. First, invoice payment patterns. Second, user event activity. Let's start with invoices.",
      "annotations": {
        "type": "opening",
        "expectedBehavior": "Agent should acknowledge both threads and start with invoices"
      }
    },
    {
      "turnNumber": 2,
      "role": "user",
      "content": "For invoices, only include those with amount > $100.",
      "annotations": {
        "type": "correction",
        "isCorrection": true,
        "establishesFilter": "Invoice amount > $100",
        "correctionType": "explicit",
        "threadContext": "A",
        "expectedBehavior": "Agent should filter to invoices > $100"
      }
    },
    {
      "turnNumber": 3,
      "role": "user",
      "content": "Thread B — show me event types by volume.",
      "annotations": {
        "type": "hypothesis_exploration",
        "threadContext": "B",
        "expectedBehavior": "Agent should show event counts by type"
      }
    },
    {
      "turnNumber": 4,
      "role": "user",
      "content": "For events, only count events from active users (logged in within 90 days).",
      "annotations": {
        "type": "correction",
        "isCorrection": true,
        "establishesFilter": "Active users = logged in within 90 days",
        "correctionType": "explicit",
        "threadContext": "B",
        "expectedBehavior": "Agent should use 90-day activity window"
      }
    },
    {
      "turnNumber": 5,
      "role": "user",
      "content": "Is there a correlation? Do accounts with failed invoices have different event patterns?",
      "annotations": {
        "type": "hypothesis_exploration",
        "expectedBehavior": "Agent should cross-reference both threads"
      }
    },
    {
      "turnNumber": 6,
      "role": "user",
      "content": "Thread A — what's the average time to payment?",
      "annotations": {
        "type": "hypothesis_exploration",
        "threadContext": "A",
        "expectedBehavior": "Agent should calculate payment timing"
      }
    },
    {
      "turnNumber": 7,
      "role": "user",
      "content": "Thread B — which events correlate with retention?",
      "annotations": {
        "type": "hypothesis_exploration",
        "threadContext": "B",
        "expectedBehavior": "Agent should analyze event types vs retention"
      }
    },
    {
      "turnNumber": 8,
      "role": "user",
      "content": "Earlier in Thread A we looked at payment timing. What was the average?",
      "annotations": {
        "type": "callback",
        "isCallback": true,
        "callbackTargetTurn": 6,
        "crossesCompressionBoundary": true,
        "expectedBehavior": "Agent should recall payment timing"
      }
    },
    {
      "turnNumber": 9,
      "role": "user",
      "content": "Apply the same invoice filter to show me overdue invoices.",
      "annotations": {
        "type": "anaphoric_reference",
        "isAnaphoricReference": true,
        "anaphoricTargetTurn": 2,
        "anaphoricPhrase": "the same invoice filter",
        "crossesCompressionBoundary": true,
        "expectedBehavior": "Agent should use amount > $100 filter"
      }
    },
    {
      "turnNumber": 10,
      "role": "user",
      "content": "Apply the same event filter to show me events by industry.",
      "annotations": {
        "type": "anaphoric_reference",
        "isAnaphoricReference": true,
        "anaphoricTargetTurn": 4,
        "anaphoricPhrase": "the same event filter",
        "crossesCompressionBoundary": true,
        "expectedBehavior": "Agent should use 90-day activity filter"
      }
    },
    {
      "turnNumber": 11,
      "role": "user",
      "content": "Exclude internal test accounts from both threads.",
      "annotations": {
        "type": "correction",
        "isCorrection": true,
        "establishesFilter": "Exclude internal test accounts",
        "correctionType": "explicit",
        "expectedBehavior": "Agent should filter out test accounts"
      }
    },
    {
      "turnNumber": 12,
      "role": "user",
      "content": "Both threads — identify accounts with both failed invoices and declining events.",
      "annotations": {
        "type": "hypothesis_exploration",
        "expectedBehavior": "Agent should find intersection of both threads"
      }
    },
    {
      "turnNumber": 13,
      "role": "user",
      "content": "What filters are active for thread A?",
      "annotations": {
        "type": "probe",
        "threadContext": "A",
        "expectedBehavior": "Agent should list: amount > $100, exclude test"
      }
    },
    {
      "turnNumber": 14,
      "role": "user",
      "content": "Final synthesis — summarize invoice and event findings.",
      "annotations": {
        "type": "final_query",
        "expectedBehavior": "Agent should synthesize both threads"
      }
    },
    {
      "turnNumber": 15,
      "role": "user",
      "content": "Thread B — what was the active user definition we used?",
      "annotations": {
        "type": "callback",
        "isCallback": true,
        "callbackTargetTurn": 4,
        "crossesCompressionBoundary": true,
        "expectedBehavior": "Agent should recall 90-day activity definition"
      }
    }
  ],
  "persistedCorrections": [
    {
      "turnEstablished": 2,
      "correctionText": "Invoice amount > $100",
      "type": "filter_rule",
      "description": "Filter to significant invoices (Thread A)"
    },
    {
      "turnEstablished": 4,
      "correctionText": "Active users = logged in within 90 days",
      "type": "filter_rule",
      "description": "Use 90-day activity window (Thread B)"
    },
    {
      "turnEstablished": 11,
      "correctionText": "Exclude internal test accounts",
      "type": "exclusion",
      "description": "Filter out test accounts"
    }
  ],
  "anaphoricReferences": [
    {
      "sourceTurn": 9,
      "targetTurn": 2,
      "phrase": "the same invoice filter",
      "crossesCompressionBoundary": true,
      "expectedResolution": "Amount > $100",
      "distance": 7
    },
    {
      "sourceTurn": 10,
      "targetTurn": 4,
      "phrase": "the same event filter",
      "crossesCompressionBoundary": true,
      "expectedResolution": "90-day activity window",
      "distance": 6
    }
  ],
  "callbacks": [
    {
      "sourceTurn": 8,
      "targetTurn": 6,
      "callbackType": "value_recall",
      "expectedEntity": "Average payment timing",
      "crossesCompressionBoundary": true,
      "distance": 2
    },
    {
      "sourceTurn": 15,
      "targetTurn": 4,
      "callbackType": "filter_recall",
      "expectedEntity": "Active user definition (90 days)",
      "crossesCompressionBoundary": true,
      "distance": 11
    }
  ]
}
