{
  "id": "tpch-rci-001",
  "metadata": {
    "database": "tpch",
    "conversationType": "RCI",
    "expectedTurns": 16,
    "compressionBoundaryTurn": 6,
    "userPersona": "business",
    "tablesExplored": [
      "ORDERS",
      "LINEITEM",
      "CUSTOMER",
      "NATION",
      "REGION",
      "SUPPLIER",
      "PART"
    ],
    "description": "Revenue drop investigation focusing on orders volume and regional performance in Q3 1995"
  },
  "turns": [
    {
      "turnNumber": 1,
      "role": "user",
      "content": "Revenue dropped 18% in Q3 1995 compared to Q2 1995. Can you help me understand why?",
      "annotations": {
        "type": "opening",
        "expectedBehavior": "Agent should propose analyzing revenue comparison between Q2 and Q3"
      }
    },
    {
      "turnNumber": 2,
      "role": "user",
      "content": "Let's check if this is a volume problem — show me total orders per week for Q2 and Q3",
      "annotations": {
        "type": "hypothesis_exploration",
        "expectedBehavior": "Agent should run query showing weekly order counts for both quarters"
      }
    },
    {
      "turnNumber": 3,
      "role": "user",
      "content": "From now on, let's only look at completed orders with status 'O'. Exclude any orders with status 'F' or 'P'.",
      "annotations": {
        "type": "correction",
        "isCorrection": true,
        "establishesFilter": "O_ORDERSTATUS = 'O'",
        "correctionType": "explicit",
        "expectedBehavior": "Agent should acknowledge and apply this filter to all subsequent queries"
      }
    },
    {
      "turnNumber": 4,
      "role": "user",
      "content": "The order volume looks relatively stable. Let's look at average order value instead.",
      "annotations": {
        "type": "pivot",
        "expectedBehavior": "Agent should calculate average order value by week for both quarters"
      }
    },
    {
      "turnNumber": 5,
      "role": "user",
      "content": "Europe's revenue dropped significantly. Let me look at individual nations in Europe.",
      "annotations": {
        "type": "hypothesis_exploration",
        "expectedBehavior": "Agent should show European nations' revenue breakdown by quarter"
      }
    },
    {
      "turnNumber": 6,
      "role": "user",
      "content": "Germany and France show the biggest drops. When I say order date, always use O_ORDERDATE column, not any other date column.",
      "annotations": {
        "type": "correction",
        "isCorrection": true,
        "establishesFilter": "Always use O_ORDERDATE for order date filtering",
        "correctionType": "explicit",
        "expectedBehavior": "Agent should confirm and use O_ORDERDATE in all subsequent date-based queries"
      }
    },
    {
      "turnNumber": 7,
      "role": "user",
      "content": "Remember the weekly order volume we looked at earlier? Can you add average order value to that same breakdown?",
      "annotations": {
        "type": "anaphoric_reference",
        "isAnaphoricReference": true,
        "anaphoricTargetTurn": 2,
        "anaphoricPhrase": "the weekly order volume we looked at earlier",
        "crossesCompressionBoundary": true,
        "expectedBehavior": "Agent should combine weekly order volume with AOV metrics"
      }
    },
    {
      "turnNumber": 8,
      "role": "user",
      "content": "What was the exact revenue number for Germany in Q2? I need it as a baseline.",
      "annotations": {
        "type": "callback",
        "isCallback": true,
        "callbackTargetTurn": 5,
        "crossesCompressionBoundary": true,
        "expectedBehavior": "Agent should retrieve or calculate Germany Q2 revenue"
      }
    },
    {
      "turnNumber": 9,
      "role": "user",
      "content": "Now I want to also exclude AMERICA region from all our analyses — we're restructuring there.",
      "annotations": {
        "type": "correction",
        "isCorrection": true,
        "establishesFilter": "Exclude AMERICA region from all analyses",
        "correctionType": "explicit",
        "expectedBehavior": "Agent should acknowledge and apply region filter to subsequent queries"
      }
    },
    {
      "turnNumber": 10,
      "role": "user",
      "content": "It looks like AUTOMOBILE segment in Germany drove most of the drop. Let me see the weekly breakdown for AUTOMOBILE customers in Germany.",
      "annotations": {
        "type": "refinement",
        "expectedBehavior": "Agent should show weekly revenue for AUTOMOBILE segment in Germany"
      }
    },
    {
      "turnNumber": 11,
      "role": "user",
      "content": "What was the order count for Germany in Q2?",
      "annotations": {
        "type": "callback",
        "isCallback": true,
        "callbackTargetTurn": 5,
        "crossesCompressionBoundary": true,
        "expectedBehavior": "Agent should recall the order count from earlier analysis"
      }
    },
    {
      "turnNumber": 12,
      "role": "user",
      "content": "Do the same segmentation we did for Germany — what market segments did these French churned customers belong to?",
      "annotations": {
        "type": "anaphoric_reference",
        "isAnaphoricReference": true,
        "anaphoricTargetTurn": 10,
        "anaphoricPhrase": "the same segmentation we did for Germany",
        "crossesCompressionBoundary": true,
        "expectedBehavior": "Agent should apply market segment analysis to French churned customers"
      }
    },
    {
      "turnNumber": 13,
      "role": "user",
      "content": "Let me go back to the weekly data. Apply the same filters we've established to show me weekly orders, AOV, and revenue for Q2 and Q3, excluding AMERICA, only completed orders.",
      "annotations": {
        "type": "anaphoric_reference",
        "isAnaphoricReference": true,
        "anaphoricTargetTurn": 7,
        "anaphoricPhrase": "the same filters we've established",
        "crossesCompressionBoundary": true,
        "expectedBehavior": "Agent should apply all accumulated filters (completed orders, exclude AMERICA, use O_ORDERDATE)"
      }
    },
    {
      "turnNumber": 14,
      "role": "user",
      "content": "Just to confirm — what filters are we currently applying to all our analyses?",
      "annotations": {
        "type": "probe",
        "expectedBehavior": "Agent should list all established filters: O_ORDERSTATUS='O', use O_ORDERDATE, exclude AMERICA"
      }
    },
    {
      "turnNumber": 15,
      "role": "user",
      "content": "Perfect. Now apply all of those to show me the top 10 suppliers by revenue for the entire period, excluding AMERICA.",
      "annotations": {
        "type": "final_query",
        "expectedBehavior": "Agent should show top suppliers with all filters applied"
      }
    },
    {
      "turnNumber": 16,
      "role": "user",
      "content": "Thank you. I think we've identified the root cause: the AUTOMOBILE segment in Germany, driven by supplier issues with parts for that segment. Let me save this analysis.",
      "annotations": {
        "type": "final_query",
        "expectedBehavior": "Agent should acknowledge and summarize findings"
      }
    }
  ],
  "persistedCorrections": [
    {
      "turnEstablished": 3,
      "correctionText": "Only look at completed orders with status 'O'",
      "type": "filter_rule",
      "description": "All subsequent queries should filter O_ORDERSTATUS = 'O'"
    },
    {
      "turnEstablished": 6,
      "correctionText": "Always use O_ORDERDATE for order date filtering",
      "type": "date_column",
      "description": "Use O_ORDERDATE instead of any other date column"
    },
    {
      "turnEstablished": 9,
      "correctionText": "Exclude AMERICA region from all analyses",
      "type": "exclusion",
      "description": "Filter out R_NAME != 'AMERICA' in all region-related queries"
    }
  ],
  "anaphoricReferences": [
    {
      "sourceTurn": 7,
      "targetTurn": 2,
      "phrase": "the weekly order volume we looked at earlier",
      "crossesCompressionBoundary": true,
      "expectedResolution": "Weekly order count breakdown from turn 2",
      "distance": 5
    },
    {
      "sourceTurn": 12,
      "targetTurn": 10,
      "phrase": "the same segmentation we did for Germany",
      "crossesCompressionBoundary": true,
      "expectedResolution": "Market segment analysis approach from turn 10",
      "distance": 2
    },
    {
      "sourceTurn": 13,
      "targetTurn": 7,
      "phrase": "the same filters we've established",
      "crossesCompressionBoundary": true,
      "expectedResolution": "All accumulated filters: O_ORDERSTATUS='O', O_ORDERDATE, exclude AMERICA",
      "distance": 6
    }
  ],
  "callbacks": [
    {
      "sourceTurn": 8,
      "targetTurn": 5,
      "callbackType": "value_recall",
      "expectedEntity": "Germany Q2 revenue",
      "crossesCompressionBoundary": true,
      "distance": 3
    },
    {
      "sourceTurn": 11,
      "targetTurn": 5,
      "callbackType": "value_recall",
      "expectedEntity": "Germany order count in Q2",
      "crossesCompressionBoundary": true,
      "distance": 6
    }
  ]
}
